{
  "schema": "slvs-json/1",
  "units": "mm",
  "parameters": {
    "module": 2.0,
    "pressure_angle": 20.0,
    "sun_radius": 24.0,
    "sun_teeth": 24,
    "inner_planet_radius": 12.0,
    "inner_planet_teeth": 12,
    "outer_planet_radius": 18.0,
    "outer_planet_teeth": 18,
    "ring_radius": 72.0,
    "ring_teeth": 72,
    "sun_to_inner": 36.0,
    "inner_to_outer": 30.0
  },
  "entities": [
    {
      "type": "gear",
      "id": "sun",
      "center": [0, 0, 0],
      "teeth": "$sun_teeth",
      "module": "$module",
      "pressure_angle": "$pressure_angle",
      "phase": 0
    },
    {
      "type": "gear",
      "id": "inner1",
      "center": [36, 0, 0],
      "teeth": "$inner_planet_teeth",
      "module": "$module",
      "pressure_angle": "$pressure_angle",
      "phase": 15
    },
    {
      "type": "gear",
      "id": "inner2",
      "center": [18, 31.18, 0],
      "teeth": "$inner_planet_teeth",
      "module": "$module",
      "pressure_angle": "$pressure_angle",
      "phase": 75
    },
    {
      "type": "gear",
      "id": "inner3",
      "center": [-18, 31.18, 0],
      "teeth": "$inner_planet_teeth",
      "module": "$module",
      "pressure_angle": "$pressure_angle",
      "phase": 135
    },
    {
      "type": "gear",
      "id": "inner4",
      "center": [-36, 0, 0],
      "teeth": "$inner_planet_teeth",
      "module": "$module",
      "pressure_angle": "$pressure_angle",
      "phase": 195
    },
    {
      "type": "gear",
      "id": "inner5",
      "center": [-18, -31.18, 0],
      "teeth": "$inner_planet_teeth",
      "module": "$module",
      "pressure_angle": "$pressure_angle",
      "phase": 255
    },
    {
      "type": "gear",
      "id": "inner6",
      "center": [18, -31.18, 0],
      "teeth": "$inner_planet_teeth",
      "module": "$module",
      "pressure_angle": "$pressure_angle",
      "phase": 315
    },
    {
      "type": "gear",
      "id": "outer1",
      "center": [31.18, 18, 0],
      "teeth": "$outer_planet_teeth",
      "module": "$module",
      "pressure_angle": "$pressure_angle",
      "phase": 30
    },
    {
      "type": "gear",
      "id": "outer2",
      "center": [0, 36, 0],
      "teeth": "$outer_planet_teeth",
      "module": "$module",
      "pressure_angle": "$pressure_angle",
      "phase": 90
    },
    {
      "type": "gear",
      "id": "outer3",
      "center": [-31.18, 18, 0],
      "teeth": "$outer_planet_teeth",
      "module": "$module",
      "pressure_angle": "$pressure_angle",
      "phase": 150
    },
    {
      "type": "gear",
      "id": "outer4",
      "center": [-31.18, -18, 0],
      "teeth": "$outer_planet_teeth",
      "module": "$module",
      "pressure_angle": "$pressure_angle",
      "phase": 210
    },
    {
      "type": "gear",
      "id": "outer5",
      "center": [0, -36, 0],
      "teeth": "$outer_planet_teeth",
      "module": "$module",
      "pressure_angle": "$pressure_angle",
      "phase": 270
    },
    {
      "type": "gear",
      "id": "outer6",
      "center": [31.18, -18, 0],
      "teeth": "$outer_planet_teeth",
      "module": "$module",
      "pressure_angle": "$pressure_angle",
      "phase": 330
    },
    {
      "type": "gear",
      "id": "ring",
      "center": [0, 0, 0],
      "teeth": "$ring_teeth",
      "module": "$module",
      "pressure_angle": "$pressure_angle",
      "internal": true,
      "phase": 0
    }
  ],
  "constraints": [
    {
      "type": "mesh",
      "gear1": "sun",
      "gear2": "inner1"
    },
    {
      "type": "mesh",
      "gear1": "sun",
      "gear2": "inner2"
    },
    {
      "type": "mesh",
      "gear1": "sun",
      "gear2": "inner3"
    },
    {
      "type": "mesh",
      "gear1": "sun",
      "gear2": "inner4"
    },
    {
      "type": "mesh",
      "gear1": "sun",
      "gear2": "inner5"
    },
    {
      "type": "mesh",
      "gear1": "sun",
      "gear2": "inner6"
    },
    {
      "type": "mesh",
      "gear1": "inner1",
      "gear2": "outer1"
    },
    {
      "type": "mesh",
      "gear1": "inner2",
      "gear2": "outer1"
    },
    {
      "type": "mesh",
      "gear1": "inner2",
      "gear2": "outer2"
    },
    {
      "type": "mesh",
      "gear1": "inner3",
      "gear2": "outer2"
    },
    {
      "type": "mesh",
      "gear1": "inner3",
      "gear2": "outer3"
    },
    {
      "type": "mesh",
      "gear1": "inner4",
      "gear2": "outer3"
    },
    {
      "type": "mesh",
      "gear1": "inner4",
      "gear2": "outer4"
    },
    {
      "type": "mesh",
      "gear1": "inner5",
      "gear2": "outer4"
    },
    {
      "type": "mesh",
      "gear1": "inner5",
      "gear2": "outer5"
    },
    {
      "type": "mesh",
      "gear1": "inner6",
      "gear2": "outer5"
    },
    {
      "type": "mesh",
      "gear1": "inner6",
      "gear2": "outer6"
    },
    {
      "type": "mesh",
      "gear1": "inner1",
      "gear2": "outer6"
    },
    {
      "type": "mesh",
      "gear1": "ring",
      "gear2": "outer1"
    },
    {
      "type": "mesh",
      "gear1": "ring",
      "gear2": "outer2"
    },
    {
      "type": "mesh",
      "gear1": "ring",
      "gear2": "outer3"
    },
    {
      "type": "mesh",
      "gear1": "ring",
      "gear2": "outer4"
    },
    {
      "type": "mesh",
      "gear1": "ring",
      "gear2": "outer5"
    },
    {
      "type": "mesh",
      "gear1": "ring",
      "gear2": "outer6"
    }
  ]
}