{
  "schema": "slvs-json/1",
  "units": "mm",
  "parameters": {
    "sun_diameter": 30.0,
    "inner_planet_diameter": 20.0,
    "outer_planet_diameter": 20.0,
    "ring_diameter": 106.6
  },
  "entities": [
    {
      "type": "circle",
      "id": "sun",
      "center": [0, 0, 0],
      "diameter": "$sun_diameter"
    },
    {
      "type": "circle",
      "id": "inner1",
      "center": [25, 0, 0],
      "diameter": "$inner_planet_diameter"
    },
    {
      "type": "circle",
      "id": "inner2",
      "center": [12.5, 21.65, 0],
      "diameter": "$inner_planet_diameter"
    },
    {
      "type": "circle",
      "id": "inner3",
      "center": [-12.5, 21.65, 0],
      "diameter": "$inner_planet_diameter"
    },
    {
      "type": "circle",
      "id": "inner4",
      "center": [-25, 0, 0],
      "diameter": "$inner_planet_diameter"
    },
    {
      "type": "circle",
      "id": "inner5",
      "center": [-12.5, -21.65, 0],
      "diameter": "$inner_planet_diameter"
    },
    {
      "type": "circle",
      "id": "inner6",
      "center": [12.5, -21.65, 0],
      "diameter": "$inner_planet_diameter"
    },
    {
      "type": "circle",
      "id": "outer1",
      "center": [37.5, 21.65, 0],
      "diameter": "$outer_planet_diameter"
    },
    {
      "type": "circle",
      "id": "outer2",
      "center": [0, 43.3, 0],
      "diameter": "$outer_planet_diameter"
    },
    {
      "type": "circle",
      "id": "outer3",
      "center": [-37.5, 21.65, 0],
      "diameter": "$outer_planet_diameter"
    },
    {
      "type": "circle",
      "id": "outer4",
      "center": [-37.5, -21.65, 0],
      "diameter": "$outer_planet_diameter"
    },
    {
      "type": "circle",
      "id": "outer5",
      "center": [0, -43.3, 0],
      "diameter": "$outer_planet_diameter"
    },
    {
      "type": "circle",
      "id": "outer6",
      "center": [37.5, -21.65, 0],
      "diameter": "$outer_planet_diameter"
    },
    {
      "type": "circle",
      "id": "ring",
      "center": [0, 0, 0],
      "diameter": "$ring_diameter"
    }
  ],
  "constraints": [
    {
      "type": "distance",
      "between": ["sun", "inner1"],
      "value": "($sun_diameter + $inner_planet_diameter) / 2"
    },
    {
      "type": "distance",
      "between": ["sun", "inner2"],
      "value": "($sun_diameter + $inner_planet_diameter) / 2"
    },
    {
      "type": "distance",
      "between": ["sun", "inner3"],
      "value": "($sun_diameter + $inner_planet_diameter) / 2"
    },
    {
      "type": "distance",
      "between": ["sun", "inner4"],
      "value": "($sun_diameter + $inner_planet_diameter) / 2"
    },
    {
      "type": "distance",
      "between": ["sun", "inner5"],
      "value": "($sun_diameter + $inner_planet_diameter) / 2"
    },
    {
      "type": "distance",
      "between": ["sun", "inner6"],
      "value": "($sun_diameter + $inner_planet_diameter) / 2"
    },
    {
      "type": "distance",
      "between": ["outer1", "inner1"],
      "value": "($inner_planet_diameter + $outer_planet_diameter) / 2"
    },
    {
      "type": "distance",
      "between": ["outer1", "inner2"],
      "value": "($inner_planet_diameter + $outer_planet_diameter) / 2"
    },
    {
      "type": "distance",
      "between": ["outer2", "inner2"],
      "value": "($inner_planet_diameter + $outer_planet_diameter) / 2"
    },
    {
      "type": "distance",
      "between": ["outer2", "inner3"],
      "value": "($inner_planet_diameter + $outer_planet_diameter) / 2"
    },
    {
      "type": "distance",
      "between": ["outer3", "inner3"],
      "value": "($inner_planet_diameter + $outer_planet_diameter) / 2"
    },
    {
      "type": "distance",
      "between": ["outer3", "inner4"],
      "value": "($inner_planet_diameter + $outer_planet_diameter) / 2"
    },
    {
      "type": "distance",
      "between": ["outer4", "inner4"],
      "value": "($inner_planet_diameter + $outer_planet_diameter) / 2"
    },
    {
      "type": "distance",
      "between": ["outer4", "inner5"],
      "value": "($inner_planet_diameter + $outer_planet_diameter) / 2"
    },
    {
      "type": "distance",
      "between": ["outer5", "inner5"],
      "value": "($inner_planet_diameter + $outer_planet_diameter) / 2"
    },
    {
      "type": "distance",
      "between": ["outer5", "inner6"],
      "value": "($inner_planet_diameter + $outer_planet_diameter) / 2"
    },
    {
      "type": "distance",
      "between": ["outer6", "inner6"],
      "value": "($inner_planet_diameter + $outer_planet_diameter) / 2"
    },
    {
      "type": "distance",
      "between": ["outer6", "inner1"],
      "value": "($inner_planet_diameter + $outer_planet_diameter) / 2"
    },
    {
      "type": "distance",
      "between": ["outer1", "outer2"],
      "value": "$outer_planet_diameter"
    },
    {
      "type": "distance",
      "between": ["outer2", "outer3"],
      "value": "$outer_planet_diameter"
    },
    {
      "type": "distance",
      "between": ["outer3", "outer4"],
      "value": "$outer_planet_diameter"
    },
    {
      "type": "distance",
      "between": ["outer4", "outer5"],
      "value": "$outer_planet_diameter"
    },
    {
      "type": "distance",
      "between": ["outer5", "outer6"],
      "value": "$outer_planet_diameter"
    },
    {
      "type": "distance",
      "between": ["outer6", "outer1"],
      "value": "$outer_planet_diameter"
    },
    {
      "type": "distance",
      "between": ["ring", "outer1"],
      "value": "($ring_diameter - $outer_planet_diameter) / 2"
    },
    {
      "type": "distance",
      "between": ["ring", "outer2"],
      "value": "($ring_diameter - $outer_planet_diameter) / 2"
    },
    {
      "type": "distance",
      "between": ["ring", "outer3"],
      "value": "($ring_diameter - $outer_planet_diameter) / 2"
    },
    {
      "type": "distance",
      "between": ["ring", "outer4"],
      "value": "($ring_diameter - $outer_planet_diameter) / 2"
    },
    {
      "type": "distance",
      "between": ["ring", "outer5"],
      "value": "($ring_diameter - $outer_planet_diameter) / 2"
    },
    {
      "type": "distance",
      "between": ["ring", "outer6"],
      "value": "($ring_diameter - $outer_planet_diameter) / 2"
    }
  ]
}