{
  "schema": "slvs-json/1",
  "units": "mm",
  "parameters": {
    "gear_diameter": 20.0,
    "inner_radius": 30.0,
    "outer_radius": 50.0
  },
  "entities": [
    {
      "type": "circle",
      "id": "inner1",
      "center": ["$inner_radius", 0, 0],
      "diameter": "$gear_diameter"
    },
    {
      "type": "circle",
      "id": "inner2",
      "center": ["$inner_radius * 0.5", "$inner_radius * 0.866", 0],
      "diameter": "$gear_diameter"
    },
    {
      "type": "circle",
      "id": "inner3",
      "center": ["$inner_radius * (-0.5)", "$inner_radius * 0.866", 0],
      "diameter": "$gear_diameter"
    },
    {
      "type": "circle",
      "id": "inner4",
      "center": ["$inner_radius * (-1)", 0, 0],
      "diameter": "$gear_diameter"
    },
    {
      "type": "circle",
      "id": "inner5",
      "center": ["$inner_radius * (-0.5)", "$inner_radius * (-0.866)", 0],
      "diameter": "$gear_diameter"
    },
    {
      "type": "circle",
      "id": "inner6",
      "center": ["$inner_radius * 0.5", "$inner_radius * (-0.866)", 0],
      "diameter": "$gear_diameter"
    },
    {
      "type": "circle",
      "id": "outer1",
      "center": ["$outer_radius * 0.866", "$outer_radius * 0.5", 0],
      "diameter": "$gear_diameter"
    },
    {
      "type": "circle",
      "id": "outer2",
      "center": [0, "$outer_radius", 0],
      "diameter": "$gear_diameter"
    },
    {
      "type": "circle",
      "id": "outer3",
      "center": ["$outer_radius * (-0.866)", "$outer_radius * 0.5", 0],
      "diameter": "$gear_diameter"
    },
    {
      "type": "circle",
      "id": "outer4",
      "center": ["$outer_radius * (-0.866)", "$outer_radius * (-0.5)", 0],
      "diameter": "$gear_diameter"
    },
    {
      "type": "circle",
      "id": "outer5",
      "center": [0, "$outer_radius * (-1)", 0],
      "diameter": "$gear_diameter"
    },
    {
      "type": "circle",
      "id": "outer6",
      "center": ["$outer_radius * 0.866", "$outer_radius * (-0.5)", 0],
      "diameter": "$gear_diameter"
    }
  ],
  "constraints": []
}