{
  "schema": "slvs-json/1",
  "units": "mm",
  "parameters": {
    "module": 2.0,
    "pressure_angle": 20.0
  },
  "entities": [
    {
      "type": "gear",
      "id": "gear1",
      "center": [0, 0, 0],
      "teeth": 20,
      "module": "$module",
      "pressure_angle": "$pressure_angle",
      "phase": 0.0,
      "internal": false
    },
    {
      "type": "gear",
      "id": "gear2",
      "center": [40, 0, 0],
      "teeth": 20,
      "module": "$module",
      "pressure_angle": "$pressure_angle",
      "phase": 0.0,
      "internal": false
    }
  ],
  "constraints": [
    {
      "type": "mesh",
      "gear1": "gear1",
      "gear2": "gear2"
    }
  ]
}