{
  "schema": "slvs-json/1",
  "units": "mm",
  "parameters": {
    "length": 100.0
  },
  "entities": [
    {
      "type": "point",
      "id": "A",
      "at": [0, 0, 0]
    },
    {
      "type": "point",
      "id": "B",
      "at": [80, 20, 0]
    },
    {
      "type": "line",
      "id": "AB",
      "p1": "A",
      "p2": "B"
    }
  ],
  "constraints": [
    {
      "type": "fixed",
      "entity": "A"
    },
    {
      "type": "distance",
      "between": ["A", "B"],
      "value": "$length"
    }
  ]
}