{
  "schema": "slvs-json/1",
  "units": "mm",
  "parameters": {
    "gear_radius": 10.0,
    "inner_orbit": 20.0,
    "outer_orbit": 40.0
  },
  "entities": [
    {
      "type": "circle",
      "id": "inner1",
      "center": ["$inner_orbit", 0, 0],
      "diameter": "$gear_radius * 2"
    },
    {
      "type": "circle",
      "id": "inner2",
      "center": ["$inner_orbit * 0.5", "$inner_orbit * 0.866", 0],
      "diameter": "$gear_radius * 2"
    },
    {
      "type": "circle",
      "id": "inner3",
      "center": ["$inner_orbit * (-0.5)", "$inner_orbit * 0.866", 0],
      "diameter": "$gear_radius * 2"
    },
    {
      "type": "circle",
      "id": "inner4",
      "center": ["$inner_orbit * (-1)", 0, 0],
      "diameter": "$gear_radius * 2"
    },
    {
      "type": "circle",
      "id": "inner5",
      "center": ["$inner_orbit * (-0.5)", "$inner_orbit * (-0.866)", 0],
      "diameter": "$gear_radius * 2"
    },
    {
      "type": "circle",
      "id": "inner6",
      "center": ["$inner_orbit * 0.5", "$inner_orbit * (-0.866)", 0],
      "diameter": "$gear_radius * 2"
    },
    {
      "type": "circle",
      "id": "outer1",
      "center": ["$outer_orbit * 0.866", "$outer_orbit * 0.5", 0],
      "diameter": "$gear_radius * 2"
    },
    {
      "type": "circle",
      "id": "outer2",
      "center": [0, "$outer_orbit", 0],
      "diameter": "$gear_radius * 2"
    },
    {
      "type": "circle",
      "id": "outer3",
      "center": ["$outer_orbit * (-0.866)", "$outer_orbit * 0.5", 0],
      "diameter": "$gear_radius * 2"
    },
    {
      "type": "circle",
      "id": "outer4",
      "center": ["$outer_orbit * (-0.866)", "$outer_orbit * (-0.5)", 0],
      "diameter": "$gear_radius * 2"
    },
    {
      "type": "circle",
      "id": "outer5",
      "center": [0, "$outer_orbit * (-1)", 0],
      "diameter": "$gear_radius * 2"
    },
    {
      "type": "circle",
      "id": "outer6",
      "center": ["$outer_orbit * 0.866", "$outer_orbit * (-0.5)", 0],
      "diameter": "$gear_radius * 2"
    }
  ],
  "constraints": []
}