{
  "schema": "slvs-json/1",
  "units": "mm",
  "parameters": {
    "sun_diameter": 30.0,
    "inner_planet_diameter": 20.0,
    "outer_planet_diameter": 20.0
  },
  "entities": [
    {
      "type": "circle",
      "id": "sun",
      "center": [0, 0, 0],
      "diameter": "$sun_diameter"
    },
    {
      "type": "circle",
      "id": "inner1",
      "center": [25, 0, 0],
      "diameter": "$inner_planet_diameter"
    },
    {
      "type": "circle",
      "id": "inner2",
      "center": [12.5, 21.65, 0],
      "diameter": "$inner_planet_diameter"
    },
    {
      "type": "circle",
      "id": "inner3",
      "center": [-12.5, 21.65, 0],
      "diameter": "$inner_planet_diameter"
    },
    {
      "type": "circle",
      "id": "inner4",
      "center": [-25, 0, 0],
      "diameter": "$inner_planet_diameter"
    },
    {
      "type": "circle",
      "id": "inner5",
      "center": [-12.5, -21.65, 0],
      "diameter": "$inner_planet_diameter"
    },
    {
      "type": "circle",
      "id": "inner6",
      "center": [12.5, -21.65, 0],
      "diameter": "$inner_planet_diameter"
    },
    {
      "type": "circle",
      "id": "outer1",
      "center": [28.75, 16.59, 0],
      "diameter": "$outer_planet_diameter"
    },
    {
      "type": "circle",
      "id": "outer2",
      "center": [0, 33.2, 0],
      "diameter": "$outer_planet_diameter"
    },
    {
      "type": "circle",
      "id": "outer3",
      "center": [-28.75, 16.59, 0],
      "diameter": "$outer_planet_diameter"
    },
    {
      "type": "circle",
      "id": "outer4",
      "center": [-28.75, -16.59, 0],
      "diameter": "$outer_planet_diameter"
    },
    {
      "type": "circle",
      "id": "outer5",
      "center": [0, -33.2, 0],
      "diameter": "$outer_planet_diameter"
    },
    {
      "type": "circle",
      "id": "outer6",
      "center": [28.75, -16.59, 0],
      "diameter": "$outer_planet_diameter"
    },
    {
      "type": "circle",
      "id": "ring",
      "center": [0, 0, 0],
      "diameter": 86.4
    }
  ],
  "constraints": []
}